{
  "name": "10k Science Adaptive Homepage Cards",
  "version": "2026-04-28",
  "status": "public",
  "description": "Homepage-ready content cards derived from the public 10k Knowledge Base. These cards are designed for adaptive presentation, RAG retrieval, and audience-specific content selection.",
  "base_url": "https://10kscience.github.io/10k-knowledge-base/",
  "last_reviewed": "2026-04-28",
  "default_cta": {
    "label": "Start Free Trial",
    "url": "https://dashboard.10k.science/"
  },
  "selection_guidance": {
    "summary": "Use cards for short adaptive homepage modules and use chunks for detailed answers. Rank by known audience, then topic match, then priority. Use source_chunks and canonical_url for attribution and deeper follow-up.",
    "ranking_fields": ["audiences", "topics", "content_type", "priority"],
    "fallback_cards": ["educator-free-trial", "science-vr-classrooms", "content-library", "faq"]
  },
  "cards": [
    {
      "id": "educator-free-trial",
      "title": "Try 10k Science With Your Class",
      "content_type": "cta",
      "audiences": ["educators", "administrators", "institutions"],
      "topics": ["free trial", "web platform", "web viewer", "educator dashboard", "formative assessment"],
      "summary": "Educators can start a free trial account for the 10k Science web platform, including the browser-based web viewer and Educator Dashboard.",
      "body": "10k Science supports web and VR science learning. The web platform gives educators a way to try immersive science experiences, AI-guided learning, spoken student responses, and dashboard-based formative assessment without requiring every student to use a headset.",
      "cta_label": "Start Free Trial",
      "cta_url": "https://dashboard.10k.science/",
      "source_chunks": ["product-overview", "dashboard-guides-analytics", "formative-assessment", "faq"],
      "canonical_url": "https://10kscience.github.io/10k-knowledge-base/content/product/10k-science/dashboard-guides-analytics/",
      "priority": 100
    },
    {
      "id": "web-viewer-and-dashboard",
      "title": "Web Viewer And Educator Dashboard",
      "content_type": "feature-card",
      "audiences": ["educators", "administrators", "institutions"],
      "topics": ["web viewer", "Educator Dashboard", "AI Guides", "spoken responses", "formative assessment", "classroom implementation"],
      "summary": "The 10k Science web platform combines the browser-based Viewer, AI Guides, spoken student responses, formative assessment, and the Educator Dashboard.",
      "body": "Students can explore immersive 3D science environments in a browser while AI Guides prompt them to observe and explain. Teachers can use the Educator Dashboard to review student progress, verbal responses, AI-assisted scoring, and patterns in understanding.",
      "cta_label": "Start Free Trial",
      "cta_url": "https://dashboard.10k.science/",
      "source_chunks": ["dashboard-guides-analytics", "educators", "product-overview"],
      "canonical_url": "https://10kscience.github.io/10k-knowledge-base/content/product/10k-science/dashboard-guides-analytics/",
      "priority": 98
    },
    {
      "id": "science-vr-classrooms",
      "title": "Science VR And Web Learning For Classrooms",
      "content_type": "audience-card",
      "audiences": ["educators", "administrators", "parents"],
      "topics": ["science VR", "classroom VR", "Meta Quest", "web viewer", "NGSS"],
      "summary": "10k Science combines immersive 3D environments, real scientific data, NGSS-aligned learning design, AI Guides, formative assessment, and educator-facing insights for classroom science learning.",
      "body": "The platform is built for science concepts that are hard to teach with text, diagrams, or video alone. Students can explore microscopic, molecular, environmental, and systems-level science in VR or on the web.",
      "cta_label": "Read Classroom Overview",
      "cta_url": "https://10kscience.github.io/10k-knowledge-base/content/discovery/science-vr-apps/",
      "source_chunks": ["discovery-science-vr-apps", "educators", "product-overview"],
      "canonical_url": "https://10kscience.github.io/10k-knowledge-base/content/discovery/science-vr-apps/",
      "priority": 95
    },
    {
      "id": "ai-guided-formative-assessment",
      "title": "AI-Guided Formative Assessment",
      "content_type": "feature-card",
      "audiences": ["educators", "administrators", "institutions"],
      "topics": ["AI Guides", "formative assessment", "spoken responses", "educator dashboard", "instructional agents"],
      "summary": "AI Guides prompt students during immersive science experiences, listen to spoken responses, provide feedback, and surface student thinking through the Educator Dashboard.",
      "body": "10k Science is positioned as a formative assessment tool, not a high-stakes testing system. Students explain what they understand while exploring, and teachers can use dashboard insights to identify where students need support.",
      "cta_label": "Explore AI Guides",
      "cta_url": "https://10kscience.github.io/10k-knowledge-base/content/discovery/ai-guided-formative-assessment/",
      "source_chunks": ["discovery-ai-formative-assessment", "dashboard-guides-analytics", "formative-assessment", "faq"],
      "canonical_url": "https://10kscience.github.io/10k-knowledge-base/content/discovery/ai-guided-formative-assessment/",
      "priority": 94
    },
    {
      "id": "ngss-crosscutting-concepts",
      "title": "NGSS-Aligned Immersive Science",
      "content_type": "curriculum-card",
      "audiences": ["educators", "administrators", "curriculum partners"],
      "topics": ["NGSS", "crosscutting concepts", "science practices", "curriculum", "Lawrence Hall of Science"],
      "summary": "10k Science content is developed to align with the Next Generation Science Standards in partnership with the Lawrence Hall of Science.",
      "body": "The platform supports NGSS-aligned learning by giving students scientific systems to explore and prompts that ask them to observe, compare, explain, and connect ideas across scale, cause and effect, systems, structure and function, and stability and change.",
      "cta_label": "See NGSS Fit",
      "cta_url": "https://10kscience.github.io/10k-knowledge-base/content/discovery/ngss-immersive-science/",
      "source_chunks": ["discovery-ngss-immersive-science", "content-library", "faq"],
      "canonical_url": "https://10kscience.github.io/10k-knowledge-base/content/discovery/ngss-immersive-science/",
      "priority": 90
    },
    {
      "id": "content-library",
      "title": "A Growing Library Of Immersive Science Experiences",
      "content_type": "product-card",
      "audiences": ["educators", "students", "researchers", "institutions"],
      "topics": ["content library", "biology", "chemistry", "environmental science", "real scientific data"],
      "summary": "The 10k Science library includes immersive experiences for topics such as CRISPR, sickle cell disease, plant disease, food molecules, pain signaling, wildfire smoke, antibodies, echolocation, atomic orbitals, and chemistry.",
      "body": "10k Science is strongest for topics that are difficult to understand from text, diagrams, or video alone: systems across scale, molecular and cellular processes, cause-and-effect mechanisms, body systems, environmental systems, and biomedical or engineering interventions.",
      "cta_label": "Browse Content Library",
      "cta_url": "https://10kscience.github.io/10k-knowledge-base/content/product/10k-science/content-library/",
      "source_chunks": ["content-library", "product-overview"],
      "canonical_url": "https://10kscience.github.io/10k-knowledge-base/content/product/10k-science/content-library/",
      "priority": 88
    },
    {
      "id": "vr-biology",
      "title": "VR Biology For Web And Meta Quest",
      "content_type": "discovery-card",
      "audiences": ["educators", "students", "administrators"],
      "topics": ["VR biology", "molecular biology", "CRISPR", "cells", "Meta Quest"],
      "summary": "10k Science helps students explore biological structures and processes through immersive 3D environments built from real scientific data.",
      "body": "Biology experiences connect molecular interactions, cell processes, tissue responses, organ systems, organisms, and environmental conditions. Students can move across body, tissue, cell, molecular, and environmental scales.",
      "cta_label": "Explore VR Biology",
      "cta_url": "https://10kscience.github.io/10k-knowledge-base/content/discovery/vr-biology-app/",
      "source_chunks": ["discovery-vr-biology", "discovery-molecular-biology-3d", "content-library"],
      "canonical_url": "https://10kscience.github.io/10k-knowledge-base/content/discovery/vr-biology-app/",
      "priority": 84
    },
    {
      "id": "real-scientific-data",
      "title": "Built Around Real Scientific Data",
      "content_type": "positioning-card",
      "audiences": ["educators", "researchers", "partners", "institutions"],
      "topics": ["real scientific data", "research-based visualizations", "science visualization", "creator workflows"],
      "summary": "10k Science experiences are built around real scientific data, research-based visualizations, and collaborations with scientists and educators.",
      "body": "Dynamoid's approach turns scientific datasets, structures, models, and mechanisms into explorable visual experiences that can support learning, research communication, and science storytelling.",
      "cta_label": "Learn About Creator Workflows",
      "cta_url": "https://10kscience.github.io/10k-knowledge-base/content/audiences/researchers-and-creators/",
      "source_chunks": ["product-overview", "researchers-and-creators", "history"],
      "canonical_url": "https://10kscience.github.io/10k-knowledge-base/content/audiences/researchers-and-creators/",
      "priority": 82
    },
    {